{
  "schema_version": 1,
  "platform": "claude",
  "runtime": {
    "skill_dir_candidates": [
      ".claude/skills",
      "~/.claude/skills"
    ],
    "entrypoint": "SKILL.md"
  },
  "capabilities": {
    "supports_subagents": true,
    "supports_commands": true,
    "supports_supporting_docs": true
  },
  "constraints": {
    "text_only_public_bundle": false,
    "plugin_packaging_stable": false
  },
  "contract": {
    "sources": [
      "https://code.claude.com/docs/en/skills",
      "https://code.claude.com/docs/en/sub-agents",
      "https://code.claude.com/docs/en/security",
      "https://code.claude.com/docs/en/getting-started"
    ],
    "last_verified": "2026-07-21"
  }
}
