{
  "schema_version": 1,
  "platform": "codex",
  "runtime": {
    "skill_dir_candidates": [
      ".agents/skills",
      "~/.agents/skills"
    ],
    "entrypoint": "SKILL.md"
  },
  "capabilities": {
    "supports_subagents": true,
    "supports_commands": false,
    "supports_repo_instruction_layer": true
  },
  "constraints": {
    "text_only_public_bundle": false,
    "aggressively_evolving_surface": true
  },
  "contract": {
    "sources": [
      "https://developers.openai.com/codex/skills",
      "https://developers.openai.com/codex/guides/agents-md",
      "https://developers.openai.com/codex/cloud"
    ],
    "last_verified": "2026-06-15"
  }
}
